iso_code,country_name,landing_title,landing_description,hero_image_url
ESP,Spain,Spain Corporate Registry,Access the most comprehensive database of Spanish companies. Over 2M records available.,https://images.unsplash.com/photo-1543783207-ec64e4d95325
FRA,France,France Business Data,Unlock insights into the French market with real-time enterprise data.,https://images.unsplash.com/photo-1502602898657-3e91760cbb34
DEU,Germany,Deutsche Unternehmen,Precision data for the German economic engine. Verified and updated daily.,https://images.unsplash.com/photo-1467269204594-9661b133dd2b
GBR,United Kingdom,UK Companies House Data,Full coverage of UK registered businesses including Northern Ireland.,https://images.unsplash.com/photo-1513635269975-59663e0ac1ad
USA,United States,USA Corporate Insight,Coast to coast coverage of American enterprise data.,https://images.unsplash.com/photo-1485738422979-f5c462d49f74
JPN,Japan,Japan Enterprise Connect,Gateway to Japanese corporate intelligence.,https://images.unsplash.com/photo-1524413840807-0c3cb6fa808d
